[
    {
        "timestamp": 1770746034,
        "media": [],
        "label_values": [
            {
                "label": "Ad library public URL"
            },
            {
                "label": "URL",
                "value": "https://www.instagram.com/reel/SYNTHETIC_VIDEO/",
                "href": "https://www.instagram.com/reel/SYNTHETIC_VIDEO/"
            }
        ],
        "fbid": "17841401108516601:17851661370628099:1770746034::DYIImpressionsData"
    }
]
